{"$schema":"https://json-schema.org/draft/2020-12/schema","type":"object","required":["candidate_id","incumbent_indistinguishable","safe_case_id","unsafe_case_id","different_decisions_required","candidate_separates","causal_reason","terminal_correct","retained_regression","anti_scope_regression","disjoint_reproduction","supporting_cases","valid"],"properties":{"candidate_id":{"type":"string"},"incumbent_indistinguishable":{"type":"boolean"},"safe_case_id":{"type":"string"},"unsafe_case_id":{"type":"string"},"different_decisions_required":{"type":"boolean"},"candidate_separates":{"type":"boolean"},"causal_reason":{"type":"string"},"terminal_correct":{"type":"boolean"},"retained_regression":{"type":"boolean"},"anti_scope_regression":{"type":"boolean"},"disjoint_reproduction":{"type":"boolean"},"supporting_cases":{"type":"array","items":{"type":"string"},"minItems":2},"valid":{"type":"boolean"}},"additionalProperties":false}

